{"checker":{"id":"verislop.review-counterexample","sha256":"sha256:b49b0e019381cec6cd20446bdd5cfb98074bf4ca4d31452ebf25fb7f63490e5d"},"checkpoint":"release","claim":null,"diagnostics":["mechanical inventory artifact changed: bridges/implementation/artifacts.json"],"expected":null,"format":"verislop.review-counterexample-receipt/0.2","input_bindings":{"accepted/acceptance.json":"sha256:6e4924dc71daa337201a5f29d11bb465c66de38243029e0584272b93275bcbc4","accepted/accepted-ir.json":"sha256:f08f2065698f0e46ee192aa32fdd1120c8cae16550302314dfdf277a5270f8f9","accepted/certificates/6e4924dc71daa337201a5f29d11bb465c66de38243029e0584272b93275bcbc4.json":"sha256:6e4924dc71daa337201a5f29d11bb465c66de38243029e0584272b93275bcbc4","accepted/environment/cc27b0ded1c7e07494d6dc6ff45f850239b3d812f029e85cf2e877351e8748dc.json":"sha256:cc27b0ded1c7e07494d6dc6ff45f850239b3d812f029e85cf2e877351e8748dc","accepted/expressions/362f979ea1c27f1227a22677f3cb296da1fac9ec9ca026e4335747fdface65b5.json":"sha256:362f979ea1c27f1227a22677f3cb296da1fac9ec9ca026e4335747fdface65b5","accepted/expressions/36a274e4816bb590148d008226b75081673137ca38c4754dea6fb09fc5495e06.json":"sha256:36a274e4816bb590148d008226b75081673137ca38c4754dea6fb09fc5495e06","accepted/expressions/483bcf6953f45e611a59dcab91a6dcc1fd09c279a7b24d8be6a5f21d54a51c6c.json":"sha256:483bcf6953f45e611a59dcab91a6dcc1fd09c279a7b24d8be6a5f21d54a51c6c","accepted/expressions/7e41a33b2d140ab9790e5ae929e27cc376620fc88e11c734f0e1acf0f6e9f894.json":"sha256:7e41a33b2d140ab9790e5ae929e27cc376620fc88e11c734f0e1acf0f6e9f894","accepted/expressions/8b286194be6a729a454f717bbc0d6c06007d4b9886ad48e34c4c111bd2325750.json":"sha256:8b286194be6a729a454f717bbc0d6c06007d4b9886ad48e34c4c111bd2325750","accepted/expressions/f5f2919427591f09b997a8b056f2a31285a4187e8c155affd99436022d0e89e4.json":"sha256:f5f2919427591f09b997a8b056f2a31285a4187e8c155affd99436022d0e89e4","accepted/ir/f08f2065698f0e46ee192aa32fdd1120c8cae16550302314dfdf277a5270f8f9.json":"sha256:f08f2065698f0e46ee192aa32fdd1120c8cae16550302314dfdf277a5270f8f9","accepted/olean/00b2d35f3f09a0023ca71b8007541ca111f710c9995b02a16eb4b26bcb131844.olean":"sha256:00b2d35f3f09a0023ca71b8007541ca111f710c9995b02a16eb4b26bcb131844","accepted/profile/c0ced33986f62ff8b61ae0f75afe88b41596f737a8c50628962dbc79e43237f6.json":"sha256:c0ced33986f62ff8b61ae0f75afe88b41596f737a8c50628962dbc79e43237f6","accepted/source/4fece23c33a58e73f09e04eea12f9da4d255894d0ebef65e3af7621a8c762824.lean":"sha256:4fece23c33a58e73f09e04eea12f9da4d255894d0ebef65e3af7621a8c762824","accepted/statements/dfded836c7bf10a28f75601c95dd0bb4919307bc81b2b38e28a8382343fe4e46.json":"sha256:dfded836c7bf10a28f75601c95dd0bb4919307bc81b2b38e28a8382343fe4e46","binding:roots":"sha256:f69f64b6a371777e3e4d7ba420a0a689c803cb81b15d3586bd7bd3e974833475","bridges/bindings.json":"sha256:8d1e16f2a472c56412d188f30d199e57b8231637626728763d10ba7af7567dee","bridges/implementation/accepted/accepted-ir.json":"sha256:f08f2065698f0e46ee192aa32fdd1120c8cae16550302314dfdf277a5270f8f9","bridges/implementation/accepted/certificates/6e4924dc71daa337201a5f29d11bb465c66de38243029e0584272b93275bcbc4.json":"sha256:6e4924dc71daa337201a5f29d11bb465c66de38243029e0584272b93275bcbc4","bridges/implementation/accepted/environment/cc27b0ded1c7e07494d6dc6ff45f850239b3d812f029e85cf2e877351e8748dc.json":"sha256:cc27b0ded1c7e07494d6dc6ff45f850239b3d812f029e85cf2e877351e8748dc","bridges/implementation/accepted/expressions/362f979ea1c27f1227a22677f3cb296da1fac9ec9ca026e4335747fdface65b5.json":"sha256:362f979ea1c27f1227a22677f3cb296da1fac9ec9ca026e4335747fdface65b5","bridges/implementation/accepted/expressions/36a274e4816bb590148d008226b75081673137ca38c4754dea6fb09fc5495e06.json":"sha256:36a274e4816bb590148d008226b75081673137ca38c4754dea6fb09fc5495e06","bridges/implementation/accepted/expressions/483bcf6953f45e611a59dcab91a6dcc1fd09c279a7b24d8be6a5f21d54a51c6c.json":"sha256:483bcf6953f45e611a59dcab91a6dcc1fd09c279a7b24d8be6a5f21d54a51c6c","bridges/implementation/accepted/expressions/7e41a33b2d140ab9790e5ae929e27cc376620fc88e11c734f0e1acf0f6e9f894.json":"sha256:7e41a33b2d140ab9790e5ae929e27cc376620fc88e11c734f0e1acf0f6e9f894","bridges/implementation/accepted/expressions/8b286194be6a729a454f717bbc0d6c06007d4b9886ad48e34c4c111bd2325750.json":"sha256:8b286194be6a729a454f717bbc0d6c06007d4b9886ad48e34c4c111bd2325750","bridges/implementation/accepted/expressions/f5f2919427591f09b997a8b056f2a31285a4187e8c155affd99436022d0e89e4.json":"sha256:f5f2919427591f09b997a8b056f2a31285a4187e8c155affd99436022d0e89e4","bridges/implementation/accepted/olean/00b2d35f3f09a0023ca71b8007541ca111f710c9995b02a16eb4b26bcb131844.olean":"sha256:00b2d35f3f09a0023ca71b8007541ca111f710c9995b02a16eb4b26bcb131844","bridges/implementation/accepted/profile/c0ced33986f62ff8b61ae0f75afe88b41596f737a8c50628962dbc79e43237f6.json":"sha256:c0ced33986f62ff8b61ae0f75afe88b41596f737a8c50628962dbc79e43237f6","bridges/implementation/accepted/source/4fece23c33a58e73f09e04eea12f9da4d255894d0ebef65e3af7621a8c762824.lean":"sha256:4fece23c33a58e73f09e04eea12f9da4d255894d0ebef65e3af7621a8c762824","bridges/implementation/accepted/statements/dfded836c7bf10a28f75601c95dd0bb4919307bc81b2b38e28a8382343fe4e46.json":"sha256:dfded836c7bf10a28f75601c95dd0bb4919307bc81b2b38e28a8382343fe4e46","bridges/implementation/artifacts.json":"sha256:c11fed8697268b4a92de4cbc468464f3d322ffb458f63e7468cb9f8f0f82b423","claims.json":"sha256:c5e435109b448916f6e25e3a632f6cebc4874a6626c55a0158be2257dfc0b284","closure/current.json":"sha256:12ddb6863fbdb26133d64416cc3e827e92db07d102023d6ab79b0ddf95797fc7","closure/implementation-claims.json":"sha256:22224261e4b849cc750065beda0d6d00194a3dc9dc075c00509e4069744e35b3","closure/manifest.json":"sha256:ee7572a5ef0c7d0b15235879c92351d5ed9683e0e0d89a61b3b94890500208b9"},"observed":null,"proposal":{"claim_id":"BRIDGE:implementation:vscore-refinement","kind":"mechanical_failure"},"proposal_hash":"sha256:f238e32989cd7bd563e239bee0887a85edd6f77c1c0678c3246f3401b6b39403","schema_version":"0.2","status":"UNSUPPORTED"}